Sheet: ETAT ID21
C2: ID21: BORDEREAU DÉTAILLÉ DES SALAIRES VERSÉS PAR EMPLOYÉS
C4: Page 1
B7: REPUBLIQUE GABONAISE | H7: DECLARATION DES TRAITEMENTS, SALAIRES, PENSIONS VERSEES, ETC … | Y7: (art. 90 du CGI)
B8: MINISTERE DE L'ECONOMIE, DU COMMERCE | O8: Exercice …… | Q8: 2020 | R8: . . . . . . . . . . | S8: (au titre duquel les retenues ont été effectuées)
B9: DE L'INDUSTRIE ET DU TOURISME | O9: BORDEREAU DETAILLE DES SALAIRES VERSES AUX EMPLOYES
B10: ----------------------------------
B11: DIRECTION GENERALE DES IMPOTS
B12: BP 37 / 45 - Libreville | G12: NOM DE L'ENTREPRISE OU RAISON SOCIALE : = $societe["raison_sociale"]?> | X12: (art. 90 du CGI)
B13: Tel : 79.53.76/77 | G13: NIF : | I13: = $societe["nif"]?>
R14: =TRIM(RC[-2]) -> 
C16: Feuillet n° | D16: 1/N | L16: La présente déclaration est à déposer avant le 30 avril simultanément aux déclarations n° ID01 ou ID14
B18: E F F E C T I F S | C18: NIF | D18: Nom(s) et prénon(s) | E18: CODE | G18: AU 01/01/20… | L18: Période mois | P18: PRESENCE AU GABON | T18: Salaire brut de congés | U18: Total (1 à 5) | V18: IMPOTS RETENUS A LA SOURCE EN 20… | AA18: Indemnités non imposables
P19: Salaires brut de présence | Q19: AVANTAGES EN NATURE | S19: Indemnités imposables | V19: TCTS | W19: IRPP | X19: FNH | Y19: CFP | Z19: TOTAL (7+8+10)
E20: EMPLOI | F20: NIVEAU | G20: NATIONAL | H20: AGE | I20: SEXE | J20: SIT FAMI | K20: Nbre | L20: DEBUT | N20: FIN | Q20: Logt, Eau, Electricité | R20: Nourriture
K21: ENFANTS
G22: (1) | I22: (2) | J22: (3) | P22: (1) | Q22: (2) | R22: (3) | S22: (4) | T22: (5) | U22: (6) | V22: (7) | W22: (8) | X22: (9) | Y22: (10) | Z22: (11) | AA22: (12)
B23: =$da->ordre?> | C23: 368 793 R | D23: ABESSOLO Thomas d' Aquin | E23: 403 | F23: 2 | G23: 1 | H23: 29 | I23: 1 | J23: 2 | K23: 3 | L23: 1 | M23: 4 | N23: 7 | O23: 12 | P23: 3025278 | Q23: 253351 | R23: 180000 | S23: 930000 | T23: 450000 | U23: 4838629 | V23: 118318 | W23: 53172 | X23: 85094 | Y23: 21273.5 | Z23: 277857.5 | AA23: 1809357
B24: 2 | C24: 368 794 Z | D24: ABOUMI MOUBA Kevine | E24: 403 | F24: 2 | G24: 1 | H24: 24 | I24: 1 | J24: 1 | K24: 0 | L24: 1 | M24: 4 | N24: 31 | O24: 12 | P24: 3682778 | Q24: 312430 | R24: 0 | S24: 0 | T24: 0 | U24: 3995208 | V24: 154826 | W24: 101683 | X24: 98994 | Y24: 24748.5 | Z24: 380251.5 | AA24: 1846857
B25: 3 | C25: 368 822 L | D25: NZOVI Georges Sylvain | E25: 400 | F25: 5 | G25: 1 | H25: 29 | I25: 1 | J25: 1 | K25: 0 | L25: 1 | M25: 4 | N25: 31 | O25: 12 | P25: 1677060 | Q25: 140291 | R25: 0 | S25: 0 | T25: 0 | U25: 1817351 | V25: 40045 | W25: 0 | X25: 48563 | Y25: 12140.75 | Z25: 100748.75 | AA25: 1046005
B26: 4 | C26: 126 919 Z | D26: SOULOUNGANGA née LENDOYE Elisabeth | E26: 400 | F26: 1 | G26: 1 | H26: 41 | I26: 2 | J26: 1 | K26: 3 | L26: 1 | M26: 6 | N26: 31 | O26: 12 | P26: 6210120 | Q26: 841768 | R26: 0 | S26: 700000 | T26: 0 | U26: 7751888 | V26: 426419 | W26: 35123 | X26: 196458 | Y26: 49114.5 | Z26: 707114.5 | AA26: 6584177
B27: 5 | C27: 373 025 E | D27: IVILINOT Arsène Victor | E27: 400 | F27: 5 | G27: 1 | H27: 26 | I27: 2 | J27: 2 | K27: 0 | L27: 1 | M27: 6 | N27: 7 | O27: 8 | P27: 1304380 | Q27: 119022 | R27: 0 | S27: 0 | T27: 0 | U27: 1423402 | V27: 28865 | W27: 0 | X27: 37771 | Y27: 9442.75 | Z27: 76078.75 | AA27: 819115
B28: 6 | C28: 999999A | D28: TANDA MOUELE née IBOUNDOU DIDZIENGA Marina | E28: 400 | F28: 4 | G28: 1 | H28: 31 | I28: 2 | J28: 1 | K28: 2 | L28: 1 | M28: 6 | N28: 31 | O28: 12 | P28: 1736133 | Q28: 158240 | R28: 0 | S28: 0 | T28: 0 | U28: 1894373 | V28: 54141 | W28: 0 | X28: 51730 | Y28: 12932.499999999998 | Z28: 118803.5 | AA28: 1120511
B29: 7 | C29: 373 020 Z | D29: BOULINGUI MAVOUNGOU Gatien | E29: 400 | F29: 1 | G29: 1 | H29: 48 | I29: 1 | J29: 1 | K29: 4 | L29: 1 | M29: 7 | N29: 31 | O29: 12 | P29: 5322960 | Q29: 721471 | R29: 0 | S29: 600000 | T29: 0 | U29: 6644431 | V29: 363693 | W29: 25832 | X29: 168715 | Y29: 42178.75 | Z29: 600418.75 | AA29: 5643580
B30: 8 | C30: 373 035 R | D30: MOUKEKE Marie Françoise | E30: 501 | F30: 6 | G30: 1 | H30: 39 | I30: 2 | J30: 1 | K30: 4 | L30: 1 | M30: 7 | N30: 31 | O30: 12 | P30: 513333 | Q30: 47083 | R30: 0 | S30: 150695 | T30: 0 | U30: 711111 | V30: 8100 | W30: 0 | X30: 19814 | Y30: 4953.5 | Z30: 32867.5 | AA30: 612500
B31: 9 | C31: 373 009 X | D31: ALAMBA NKONGA Ladia Rita | E31: 400 | F31: 5 | G31: 1 | H31: 33 | I31: 2 | J31: 1 | K31: 0 | L31: 1 | M31: 8 | N31: 31 | O31: 12 | P31: 1024870 | Q31: 107171 | R31: 0 | S31: 32040 | T31: 0 | U31: 1164081 | V31: 25154 | W31: 0 | X31: 32287 | Y31: 8071.75 | Z31: 65512.75 | AA31: 789573
B32: 10 | C32: 37 3011 Y | D32: ANGUILE ORIGUINOWE André Fréjis | E32: 304 | F32: 5 | G32: 1 | H32: 29 | I32: 1 | J32: 1 | K32: 0 | L32: 1 | M32: 8 | N32: 31 | O32: 12 | P32: 1121700 | Q32: 117892 | R32: 0 | S32: 0 | T32: 0 | U32: 1239592 | V32: 28366 | W32: 0 | X32: 30988 | Y32: 7747 | Z32: 67101 | AA32: 627642
B33: 11 | C33: 373 123 M | D33: MOUTANGANI Gaeline | E33: 400 | F33: 5 | G33: 1 | H33: 30 | I33: 2 | J33: 1 | K33: 0 | L33: 1 | M33: 8 | N33: 31 | O33: 12 | P33: 1024870 | Q33: 107171 | R33: 0 | S33: 32040 | T33: 0 | U33: 1164081 | V33: 25154 | W33: 0 | X33: 32287 | Y33: 8071.75 | Z33: 65512.75 | AA33: 789573
B34: 12 | C34: 373 151 C | D34: OZOUNGUET Y MBOUMBA Dayan | E34: 400 | F34: 5 | G34: 1 | H34: 36 | I34: 1 | J34: 2 | K34: 0 | L34: 1 | M34: 8 | N34: 13 | O34: 11 | P34: 1024870 | Q34: 107171 | R34: 0 | S34: 32040 | T34: 0 | U34: 1164081 | V34: 25154 | W34: 0 | X34: 32287 | Y34: 21273.5 | Z34: 78714.5 | AA34: 789573
B35: 13 | C35: 373 149 T | D35: PANDET-PANDET Rollys Christ | E35: 400 | F35: 5 | G35: 1 | H35: 27 | I35: 1 | J35: 2 | K35: 0 | L35: 1 | M35: 8 | N35: 31 | O35: 12 | P35: 1011205 | Q35: 105720 | R35: 0 | S35: 37507 | T35: 0 | U35: 1154432 | V35: 24695 | W35: 0 | X35: 32014 | Y35: 24748.5 | Z35: 81457.5 | AA35: 787240
B36: 14 | C36: 373 018 Y | D36: BIGNOUMBA IBOUILI Rufin | E36: 400 | F36: 1 | G36: 1 | H36: 62 | I36: 1 | J36: 2 | K36: 0 | L36: 1 | M36: 9 | N36: 18 | O36: 12 | P36: 3548640 | Q36: 480877 | R36: 0 | S36: 400000 | T36: 0 | U36: 4429517 | V36: 240743 | W36: 83960 | X36: 113229 | Y36: 12140.75 | Z36: 450072.75 | AA36: 3762387
B37: 15 | C37: 373 015 Y | D37: BAWENGUE Eloi | E37: 403 | F37: 2 | G37: 1 | H37: 38 | I37: 1 | J37: 2 | K37: 1 | L37: 3 | M37: 10 | N37: 31 | O37: 12 | P37: 1153426 | Q37: 121309 | R37: 0 | S37: 0 | T37: 0 | U37: 1274735 | V37: 44945 | W37: 0 | X37: 31265 | Y37: 49114.5 | Z37: 125324.5 | AA37: 613786
B38: 16 | C38: 373 157 M | D38: OSSIALI ONGAYE Erwan Alix | E38: 403 | F38: 2 | G38: 1 | H38: 34 | I38: 1 | J38: 2 | K38: 1 | L38: 3 | M38: 10 | N38: 31 | O38: 12 | P38: 1135926 | Q38: 119452 | R38: 0 | S38: 0 | T38: 0 | U38: 1255378 | V38: 44008 | W38: 0 | X38: 30915 | Y38: 9442.75 | Z38: 84365.75 | AA38: 613786
B39: 17 | C39: 373 010 O | D39: ALENDE Yane Christopher | E39: 403 | F39: 2 | G39: 1 | H39: 30 | I39: 1 | J39: 2 | K39: 1 | L39: 2 | M39: 11 | N39: 31 | O39: 12 | P39: 744784 | Q39: 78307 | R39: 0 | S39: 0 | T39: 0 | U39: 823091 | V39: 28669 | W39: 0 | X39: 20360 | Y39: 12932.499999999998 | Z39: 61961.5 | AA39: 409190
B40: 18 | C40: 368 793 R | D40: ABESSOLO Thomas d' Aquin | E40: 403 | F40: 2 | G40: 1 | H40: 29 | I40: 1 | J40: 2 | K40: 3 | L40: 1 | M40: 4 | N40: 7 | O40: 12 | P40: 3025278 | Q40: 253351 | R40: 180000 | S40: 930000 | T40: 450000 | U40: 4838629 | V40: 118318 | W40: 53172 | X40: 85094 | Y40: 21273.5 | Z40: 277857.5 | AA40: 1809357
B41: 19 | C41: 368 794 Z | D41: ABOUMI MOUBA Kevine | E41: 403 | F41: 2 | G41: 1 | H41: 24 | I41: 1 | J41: 1 | K41: 0 | L41: 1 | M41: 4 | N41: 31 | O41: 12 | P41: 3682778 | Q41: 312430 | R41: 0 | S41: 0 | T41: 0 | U41: 3995208 | V41: 154826 | W41: 101683 | X41: 98994 | Y41: 24748.5 | Z41: 380251.5 | AA41: 1846857
B42: 20 | C42: 368 822 L | D42: NZOVI Georges Sylvain | E42: 400 | F42: 5 | G42: 1 | H42: 29 | I42: 1 | J42: 1 | K42: 0 | L42: 1 | M42: 4 | N42: 31 | O42: 12 | P42: 1677060 | Q42: 140291 | R42: 0 | S42: 0 | T42: 0 | U42: 1817351 | V42: 40045 | W42: 0 | X42: 48563 | Y42: 12140.75 | Z42: 100748.75 | AA42: 1046005
B43: 21 | C43: 126 919 Z | D43: SOULOUNGANGA née LENDOYE Elisabeth | E43: 400 | F43: 1 | G43: 1 | H43: 41 | I43: 2 | J43: 1 | K43: 3 | L43: 1 | M43: 6 | N43: 31 | O43: 12 | P43: 6210120 | Q43: 841768 | R43: 0 | S43: 700000 | T43: 0 | U43: 7751888 | V43: 426419 | W43: 35123 | X43: 196458 | Y43: 49114.5 | Z43: 707114.5 | AA43: 6584177
B44: 22 | C44: 373 025 E | D44: IVILINOT Arsène Victor | E44: 400 | F44: 5 | G44: 1 | H44: 26 | I44: 2 | J44: 2 | K44: 0 | L44: 1 | M44: 6 | N44: 7 | O44: 8 | P44: 1304380 | Q44: 119022 | R44: 0 | S44: 0 | T44: 0 | U44: 1423402 | V44: 28865 | W44: 0 | X44: 37771 | Y44: 9442.75 | Z44: 76078.75 | AA44: 819115
B45: 23 | C45: 999999A | D45: TANDA MOUELE née IBOUNDOU DIDZIENGA Marina | E45: 400 | F45: 4 | G45: 1 | H45: 31 | I45: 2 | J45: 1 | K45: 2 | L45: 1 | M45: 6 | N45: 31 | O45: 12 | P45: 1736133 | Q45: 158240 | R45: 0 | S45: 0 | T45: 0 | U45: 1894373 | V45: 54141 | W45: 0 | X45: 51730 | Y45: 12932.499999999998 | Z45: 118803.5 | AA45: 1120511
B46: 24 | C46: 373 020 Z | D46: BOULINGUI MAVOUNGOU Gatien | E46: 400 | F46: 1 | G46: 1 | H46: 48 | I46: 1 | J46: 1 | K46: 4 | L46: 1 | M46: 7 | N46: 31 | O46: 12 | P46: 5322960 | Q46: 721471 | R46: 0 | S46: 600000 | T46: 0 | U46: 6644431 | V46: 363693 | W46: 25832 | X46: 168715 | Y46: 42178.75 | Z46: 600418.75 | AA46: 5643580
B47: 25 | C47: 373 035 R | D47: MOUKEKE Marie Françoise | E47: 501 | F47: 6 | G47: 1 | H47: 39 | I47: 2 | J47: 1 | K47: 4 | L47: 1 | M47: 7 | N47: 31 | O47: 12 | P47: 513333 | Q47: 47083 | R47: 0 | S47: 150695 | T47: 0 | U47: 711111 | V47: 8100 | W47: 0 | X47: 19814 | Y47: 4953.5 | Z47: 32867.5 | AA47: 612500
B48: 26 | C48: 373 009 X | D48: ALAMBA NKONGA Ladia Rita | E48: 400 | F48: 5 | G48: 1 | H48: 33 | I48: 2 | J48: 1 | K48: 0 | L48: 1 | M48: 8 | N48: 31 | O48: 12 | P48: 1024870 | Q48: 107171 | R48: 0 | S48: 32040 | T48: 0 | U48: 1164081 | V48: 25154 | W48: 0 | X48: 32287 | Y48: 8071.75 | Z48: 65512.75 | AA48: 789573
B49: 27 | C49: 37 3011 Y | D49: ANGUILE ORIGUINOWE André Fréjis | E49: 304 | F49: 5 | G49: 1 | H49: 29 | I49: 1 | J49: 1 | K49: 0 | L49: 1 | M49: 8 | N49: 31 | O49: 12 | P49: 1121700 | Q49: 117892 | R49: 0 | S49: 0 | T49: 0 | U49: 1239592 | V49: 28366 | W49: 0 | X49: 30988 | Y49: 7747 | Z49: 67101 | AA49: 627642
B50: 28 | C50: 373 123 M | D50: MOUTANGANI Gaeline | E50: 400 | F50: 5 | G50: 1 | H50: 30 | I50: 2 | J50: 1 | K50: 0 | L50: 1 | M50: 8 | N50: 31 | O50: 12 | P50: 1024870 | Q50: 107171 | R50: 0 | S50: 32040 | T50: 0 | U50: 1164081 | V50: 25154 | W50: 0 | X50: 32287 | Y50: 8071.75 | Z50: 65512.75 | AA50: 789573
B51: 29 | C51: 999999A | D51: TANDA MOUELE née IBOUNDOU DIDZIENGA Marina | E51: 400 | F51: 4 | G51: 1 | H51: 31 | I51: 2 | J51: 1 | K51: 2 | L51: 1 | M51: 6 | N51: 31 | O51: 12 | P51: 1736133 | Q51: 158240 | R51: 0 | S51: 0 | T51: 0 | U51: 1894373 | V51: 54141 | W51: 0 | X51: 51730 | Y51: 12932.499999999998 | Z51: 118803.5 | AA51: 1120511
B52: 30 | C52: 373 020 Z | D52: BOULINGUI MAVOUNGOU Gatien | E52: 400 | F52: 1 | G52: 1 | H52: 48 | I52: 1 | J52: 1 | K52: 4 | L52: 1 | M52: 7 | N52: 31 | O52: 12 | P52: 5322960 | Q52: 721471 | R52: 0 | S52: 600000 | T52: 0 | U52: 6644431 | V52: 363693 | W52: 25832 | X52: 168715 | Y52: 42178.75 | Z52: 600418.75 | AA52: 5643580
B53: 31 | C53: 373 035 R | D53: MOUKEKE Marie Françoise | E53: 501 | F53: 6 | G53: 1 | H53: 39 | I53: 2 | J53: 1 | K53: 4 | L53: 1 | M53: 7 | N53: 31 | O53: 12 | P53: 513333 | Q53: 47083 | R53: 0 | S53: 150695 | T53: 0 | U53: 711111 | V53: 8100 | W53: 0 | X53: 19814 | Y53: 4953.5 | Z53: 32867.5 | AA53: 612500
B54: 32 | C54: 373 009 X | D54: ALAMBA NKONGA Ladia Rita | E54: 400 | F54: 5 | G54: 1 | H54: 33 | I54: 2 | J54: 1 | K54: 0 | L54: 1 | M54: 8 | N54: 31 | O54: 12 | P54: 1024870 | Q54: 107171 | R54: 0 | S54: 32040 | T54: 0 | U54: 1164081 | V54: 25154 | W54: 0 | X54: 32287 | Y54: 8071.75 | Z54: 65512.75 | AA54: 789573
B55: 33 | C55: 37 3011 Y | D55: ANGUILE ORIGUINOWE André Fréjis | E55: 304 | F55: 5 | G55: 1 | H55: 29 | I55: 1 | J55: 1 | K55: 0 | L55: 1 | M55: 8 | N55: 31 | O55: 12 | P55: 1121700 | Q55: 117892 | R55: 0 | S55: 0 | T55: 0 | U55: 1239592 | V55: 28366 | W55: 0 | X55: 30988 | Y55: 7747 | Z55: 67101 | AA55: 627642
B56: 34 | C56: 373 123 M | D56: MOUTANGANI Gaeline | E56: 400 | F56: 5 | G56: 1 | H56: 30 | I56: 2 | J56: 1 | K56: 0 | L56: 1 | M56: 8 | N56: 31 | O56: 12 | P56: 1024870 | Q56: 107171 | R56: 0 | S56: 32040 | T56: 0 | U56: 1164081 | V56: 25154 | W56: 0 | X56: 32287 | Y56: 8071.75 | Z56: 65512.75 | AA56: 789573
B57: 35 | C57: 373 123 M | D57: MOUTANGANI Gaeline | E57: 400 | F57: 5 | G57: 1 | H57: 30 | I57: 2 | J57: 1 | K57: 0 | L57: 1 | M57: 8 | N57: 31 | O57: 12 | P57: 1024870 | Q57: 107171 | R57: 0 | S57: 32040 | T57: 0 | U57: 1164081 | V57: 25154 | W57: 0 | X57: 32287 | Y57: 8071.75 | Z57: 65512.75 | AA57: 789573
D58: TOTAUX A REPORTER SUR LA FEUILLE SUIVANTE | P58: =SUM(R[-35]C:R[-1]C) -> 73674551 | Q58: =SUM(R[-35]C:R[-1]C) -> 8230815 | R58: =SUM(R[-35]C:R[-1]C) -> 360000 | S58: =SUM(R[-35]C:R[-1]C) -> 6205912 | T58: =SUM(R[-35]C:R[-1]C) -> 900000 | U58: =SUM(R[-35]C:R[-1]C) -> 89371278 | V58: =SUM(R[-35]C:R[-1]C) -> 3484138 | W58: =SUM(R[-35]C:R[-1]C) -> 541412 | X58: =SUM(R[-35]C:R[-1]C) -> 2233580 | Y58: =SUM(R[-35]C:R[-1]C) -> 623030 | Z58: =SUM(R[-35]C:R[-1]C) -> 6882160 | AA58: =SUM(R[-35]C:R[-1]C) -> 60726694
D59: Joindre un bulletin indiviuduel ID19 par salarié percevant plus de 80 000 FCFA par mois
C63: 1 Nationalité : Gabonais : 1 ; CEMAC : 2 ; Autres africains : 3 ; Non africains :4
C64: 2 Sexe : Masculin ; Feminin : 2
C65: 3 Situation familiale : Marié : 1 ; Célibataire : 2 ; Veuf : 3 ; Divorcé : 4
R67: N°Page
C69: Page ni
C71: Feuillet n° | D71: ni/N | L71: La présente déclaration est à déposer avant le 30 avril simultanément aux déclarations n° ID01 ou ID14
B73: E F F E C T I F S | C73: NIF | D73: Nom(s) et prénon(s) | E73: CODE | G73: AU 01/01/20… | L73: Période mois | P73: PRESENCE AU GABON | T73: Salaire brut de congés | U73: Total (1 à 5) | V73: IMPOTS RETENUS A LA SOURCE EN 20… | AA73: Indemnités non imposables
P74: Salaires brut de présence | Q74: AVANTAGES EN NATURE | S74: Indemnités imposables | V74: TCTS | W74: IRPP | X74: FNH | Y74: CFP | Z74: TOTAL (7+8+10)
E75: EMPLOI | F75: NIVEAU | G75: NATIONAL | H75: AGE | I75: SEXE | J75: SIT FAMI | K75: Nbre | L75: DEBUT | N75: FIN | Q75: Logt, Eau, Electricité | R75: Nourriture
K76: ENFANTS
G77: (1) | I77: (2) | J77: (3) | P77: (1) | Q77: (2) | R77: (3) | S77: (4) | T77: (5) | U77: (6) | V77: (7) | W77: (8) | X77: (9) | Y77: (10) | Z77: (11) | AA77: (12)
B78: 36 | C78: 373 010 O | D78: ALENDEYane Christopher | E78: 403 | F78: 2 | G78: 1 | H78: 30 | I78: 1 | J78: 2 | K78: 1 | L78: 2 | M78: 11 | N78: 31 | O78: 12 | P78: 744784 | Q78: 78307 | R78: 0 | S78: 0 | T78: 0 | U78: 823091 | V78: 28669 | W78: 0 | X78: 20360 | Y78: 5090 | Z78: 54119 | AA78: 409190
B79: 37 | C79: 0 | D79: 0 | E79: 0 | F79: 0 | G79: 0 | H79: 0 | I79: 0 | J79: 0 | K79: 0 | L79: 0 | M79: 0 | N79: 0 | O79: 0 | P79: 0 | Q79: 0 | R79: 0 | S79: 0 | T79: 0 | U79: 0 | V79: 0 | W79: 0 | X79: 0 | Y79: 0 | Z79: 0 | AA79: 0
B80: 38 | C80: 0 | D80: 0 | E80: 0 | F80: 0 | G80: 0 | H80: 0 | I80: 0 | J80: 0 | K80: 0 | L80: 0 | M80: 0 | N80: 0 | O80: 0 | P80: 0 | Q80: 0 | R80: 0 | S80: 0 | T80: 0 | U80: 0 | V80: 0 | W80: 0 | X80: 0 | Y80: 0 | Z80: 0 | AA80: 0
B81: 39 | C81: 0 | D81: 0 | E81: 0 | F81: 0 | G81: 0 | H81: 0 | I81: 0 | J81: 0 | K81: 0 | L81: 0 | M81: 0 | N81: 0 | O81: 0 | P81: 0 | Q81: 0 | R81: 0 | S81: 0 | T81: 0 | U81: 0 | V81: 0 | W81: 0 | X81: 0 | Y81: 0 | Z81: 0 | AA81: 0
B82: 40 | C82: 0 | D82: 0 | E82: 0 | F82: 0 | G82: 0 | H82: 0 | I82: 0 | J82: 0 | K82: 0 | L82: 0 | M82: 0 | N82: 0 | O82: 0 | P82: 0 | Q82: 0 | R82: 0 | S82: 0 | T82: 0 | U82: 0 | V82: 0 | W82: 0 | X82: 0 | Y82: 0 | Z82: 0 | AA82: 0
B83: 41 | C83: 0 | D83: 0 | E83: 0 | F83: 0 | G83: 0 | H83: 0 | I83: 0 | J83: 0 | K83: 0 | L83: 0 | M83: 0 | N83: 0 | O83: 0 | P83: 0 | Q83: 0 | R83: 0 | S83: 0 | T83: 0 | U83: 0 | V83: 0 | W83: 0 | X83: 0 | Y83: 0 | Z83: 0 | AA83: 0
B84: 42 | C84: 0 | D84: 0 | E84: 0 | F84: 0 | G84: 0 | H84: 0 | I84: 0 | J84: 0 | K84: 0 | L84: 0 | M84: 0 | N84: 0 | O84: 0 | P84: 0 | Q84: 0 | R84: 0 | S84: 0 | T84: 0 | U84: 0 | V84: 0 | W84: 0 | X84: 0 | Y84: 0 | Z84: 0 | AA84: 0
B85: 43 | C85: 0 | D85: 0 | E85: 0 | F85: 0 | G85: 0 | H85: 0 | I85: 0 | J85: 0 | K85: 0 | L85: 0 | M85: 0 | N85: 0 | O85: 0 | P85: 0 | Q85: 0 | R85: 0 | S85: 0 | T85: 0 | U85: 0 | V85: 0 | W85: 0 | X85: 0 | Y85: 0 | Z85: 0 | AA85: 0
B86: 44 | C86: 0 | D86: 0 | E86: 0 | F86: 0 | G86: 0 | H86: 0 | I86: 0 | J86: 0 | K86: 0 | L86: 0 | M86: 0 | N86: 0 | O86: 0 | P86: 0 | Q86: 0 | R86: 0 | S86: 0 | T86: 0 | U86: 0 | V86: 0 | W86: 0 | X86: 0 | Y86: 0 | Z86: 0 | AA86: 0
B87: 45 | C87: 0 | D87: 0 | E87: 0 | F87: 0 | G87: 0 | H87: 0 | I87: 0 | J87: 0 | K87: 0 | L87: 0 | M87: 0 | N87: 0 | O87: 0 | P87: 0 | Q87: 0 | R87: 0 | S87: 0 | T87: 0 | U87: 0 | V87: 0 | W87: 0 | X87: 0 | Y87: 0 | Z87: 0 | AA87: 0
B88: 46 | C88: 0 | D88: 0 | E88: 0 | F88: 0 | G88: 0 | H88: 0 | I88: 0 | J88: 0 | K88: 0 | L88: 0 | M88: 0 | N88: 0 | O88: 0 | P88: 0 | Q88: 0 | R88: 0 | S88: 0 | T88: 0 | U88: 0 | V88: 0 | W88: 0 | X88: 0 | Y88: 0 | Z88: 0 | AA88: 0
B89: 47 | C89: 0 | D89: 0 | E89: 0 | F89: 0 | G89: 0 | H89: 0 | I89: 0 | J89: 0 | K89: 0 | L89: 0 | M89: 0 | N89: 0 | O89: 0 | P89: 0 | Q89: 0 | R89: 0 | S89: 0 | T89: 0 | U89: 0 | V89: 0 | W89: 0 | X89: 0 | Y89: 0 | Z89: 0 | AA89: 0
B90: 48 | C90: 0 | D90: 0 | E90: 0 | F90: 0 | G90: 0 | H90: 0 | I90: 0 | J90: 0 | K90: 0 | L90: 0 | M90: 0 | N90: 0 | O90: 0 | P90: 0 | Q90: 0 | R90: 0 | S90: 0 | T90: 0 | U90: 0 | V90: 0 | W90: 0 | X90: 0 | Y90: 0 | Z90: 0 | AA90: 0
B91: 49 | C91: 0 | D91: 0 | E91: 0 | F91: 0 | G91: 0 | H91: 0 | I91: 0 | J91: 0 | K91: 0 | L91: 0 | M91: 0 | N91: 0 | O91: 0 | P91: 0 | Q91: 0 | R91: 0 | S91: 0 | T91: 0 | U91: 0 | V91: 0 | W91: 0 | X91: 0 | Y91: 0 | Z91: 0 | AA91: 0
B92: 50 | C92: 0 | D92: 0 | E92: 0 | F92: 0 | G92: 0 | H92: 0 | I92: 0 | J92: 0 | K92: 0 | L92: 0 | M92: 0 | N92: 0 | O92: 0 | P92: 0 | Q92: 0 | R92: 0 | S92: 0 | T92: 0 | U92: 0 | V92: 0 | W92: 0 | X92: 0 | Y92: 0 | Z92: 0 | AA92: 0
B93: 51 | C93: 0 | D93: 0 | E93: 0 | F93: 0 | G93: 0 | H93: 0 | I93: 0 | J93: 0 | K93: 0 | L93: 0 | M93: 0 | N93: 0 | O93: 0 | P93: 0 | Q93: 0 | R93: 0 | S93: 0 | T93: 0 | U93: 0 | V93: 0 | W93: 0 | X93: 0 | Y93: 0 | Z93: 0 | AA93: 0
B94: 52 | C94: 0 | D94: 0 | E94: 0 | F94: 0 | G94: 0 | H94: 0 | I94: 0 | J94: 0 | K94: 0 | L94: 0 | M94: 0 | N94: 0 | O94: 0 | P94: 0 | Q94: 0 | R94: 0 | S94: 0 | T94: 0 | U94: 0 | V94: 0 | W94: 0 | X94: 0 | Y94: 0 | Z94: 0 | AA94: 0
B95: 53
B96: 54
B97: 55
B98: 56
B99: 57
B100: 58
B101: 59
B102: 60
B103: 61
B104: 62
B105: 63
B106: 64
B107: 65
B108: 66
B109: 67
B110: 68
B111: 69
B112: 70 | C112: 0 | D112: 0 | E112: 0 | F112: 0 | G112: 0 | H112: 0 | I112: 0 | J112: 0 | K112: 0 | L112: 0 | M112: 0 | N112: 0 | O112: 0 | P112: 0 | Q112: 0 | R112: 0 | S112: 0 | T112: 0 | U112: 0 | V112: 0 | W112: 0 | X112: 0 | Y112: 0 | Z112: 0 | AA112: 0
B113: 71 | C113: 0 | D113: 0 | E113: 0 | F113: 0 | G113: 0 | H113: 0 | I113: 0 | J113: 0 | K113: 0 | L113: 0 | M113: 0 | N113: 0 | O113: 0 | P113: 0 | Q113: 0 | R113: 0 | S113: 0 | T113: 0 | U113: 0 | V113: 0 | W113: 0 | X113: 0 | Y113: 0 | Z113: 0 | AA113: 0
B114: 72 | C114: 0 | D114: 0 | E114: 0 | F114: 0 | G114: 0 | H114: 0 | I114: 0 | J114: 0 | K114: 0 | L114: 0 | M114: 0 | N114: 0 | O114: 0 | P114: 0 | Q114: 0 | R114: 0 | S114: 0 | T114: 0 | U114: 0 | V114: 0 | W114: 0 | X114: 0 | Y114: 0 | Z114: 0 | AA114: 0
B115: 73 | C115: 0 | D115: 0 | E115: 0 | F115: 0 | G115: 0 | H115: 0 | I115: 0 | J115: 0 | K115: 0 | L115: 0 | M115: 0 | N115: 0 | O115: 0 | P115: 0 | Q115: 0 | R115: 0 | S115: 0 | T115: 0 | U115: 0 | V115: 0 | W115: 0 | X115: 0 | Y115: 0 | Z115: 0 | AA115: 0
B116: 74 | C116: 0 | D116: 0 | E116: 0 | F116: 0 | G116: 0 | H116: 0 | I116: 0 | J116: 0 | K116: 0 | L116: 0 | M116: 0 | N116: 0 | O116: 0 | P116: 0 | Q116: 0 | R116: 0 | S116: 0 | T116: 0 | U116: 0 | V116: 0 | W116: 0 | X116: 0 | Y116: 0 | Z116: 0 | AA116: 0
B117: 75
B118: 76
B119: 77
B120: 78
B121: 79 | C121: 0 | D121: 0 | E121: 0 | F121: 0 | G121: 0 | H121: 0 | I121: 0 | J121: 0 | K121: 0 | L121: 0 | M121: 0 | N121: 0 | O121: 0 | P121: 0 | Q121: 0 | R121: 0 | S121: 0 | T121: 0 | U121: 0 | V121: 0 | W121: 0 | X121: 0 | Y121: 0 | Z121: 0 | AA121: 0
B122: 80 | C122: 0 | D122: 0 | E122: 0 | F122: 0 | G122: 0 | H122: 0 | I122: 0 | J122: 0 | K122: 0 | L122: 0 | M122: 0 | N122: 0 | O122: 0 | P122: 0 | Q122: 0 | R122: 0 | S122: 0 | T122: 0 | U122: 0 | V122: 0 | W122: 0 | X122: 0 | Y122: 0 | Z122: 0 | AA122: 0
B123: 81 | C123: 0 | D123: 0 | E123: 0 | F123: 0 | G123: 0 | H123: 0 | I123: 0 | J123: 0 | K123: 0 | L123: 0 | M123: 0 | N123: 0 | O123: 0 | P123: 0 | Q123: 0 | R123: 0 | S123: 0 | T123: 0 | U123: 0 | V123: 0 | W123: 0 | X123: 0 | Y123: 0 | Z123: 0 | AA123: 0
B124: 82 | C124: 0 | D124: 0 | E124: 0 | F124: 0 | G124: 0 | H124: 0 | I124: 0 | J124: 0 | K124: 0 | L124: 0 | M124: 0 | N124: 0 | O124: 0 | P124: 0 | Q124: 0 | R124: 0 | S124: 0 | T124: 0 | U124: 0 | V124: 0 | W124: 0 | X124: 0 | Y124: 0 | Z124: 0 | AA124: 0
B125: 83 | C125: 0 | D125: 0 | E125: 0 | F125: 0 | G125: 0 | H125: 0 | I125: 0 | J125: 0 | K125: 0 | L125: 0 | M125: 0 | N125: 0 | O125: 0 | P125: 0 | Q125: 0 | R125: 0 | S125: 0 | T125: 0 | U125: 0 | V125: 0 | W125: 0 | X125: 0 | Y125: 0 | Z125: 0 | AA125: 0
B126: 84 | C126: 0 | D126: 0 | E126: 0 | F126: 0 | G126: 0 | H126: 0 | I126: 0 | J126: 0 | K126: 0 | L126: 0 | M126: 0 | N126: 0 | O126: 0 | P126: 0 | Q126: 0 | R126: 0 | S126: 0 | T126: 0 | U126: 0 | V126: 0 | W126: 0 | X126: 0 | Y126: 0 | Z126: 0 | AA126: 0
D127: TOTAUX | P127: =SUM(R[-49]C:R[-1]C) -> 744784 | Q127: =SUM(R[-49]C:R[-1]C) -> 78307 | R127: =SUM(R[-49]C:R[-1]C) -> 0 | S127: =SUM(R[-49]C:R[-1]C) -> 0 | T127: =SUM(R[-49]C:R[-1]C) -> 0 | U127: =SUM(R[-49]C:R[-1]C) -> 823091 | V127: =SUM(R[-49]C:R[-1]C) -> 28669 | W127: =SUM(R[-49]C:R[-1]C) -> 0 | X127: =SUM(R[-49]C:R[-1]C) -> 20360 | Y127: =SUM(R[-49]C:R[-1]C) -> 5090 | Z127: =SUM(R[-49]C:R[-1]C) -> 54119 | AA127: =SUM(R[-49]C:R[-1]C) -> 409190
D128: TOTAUX REPORTES DE LA FEUILLE PRECEDENTE | P128: =R[-70]C -> 73674551 | Q128: =R[-70]C -> 8230815 | R128: =R[-70]C -> 360000 | S128: =R[-70]C -> 6205912 | T128: =R[-70]C -> 900000 | U128: =R[-70]C -> 89371278 | V128: =R[-70]C -> 3484138 | W128: =R[-70]C -> 541412 | X128: =R[-70]C -> 2233580 | Y128: =R[-70]C -> 623030 | Z128: =R[-70]C -> 6882160 | AA128: =R[-70]C -> 60726694
D129: TOTAUX A REPORTER SUR LA FEUILLE SUIVANTE | P129: =R[-2]C+R[-1]C -> 74419335 | Q129: =R[-2]C+R[-1]C -> 8309122 | R129: =R[-2]C+R[-1]C -> 360000 | S129: =R[-2]C+R[-1]C -> 6205912 | T129: =R[-2]C+R[-1]C -> 900000 | U129: =R[-2]C+R[-1]C -> 90194369 | V129: =R[-2]C+R[-1]C -> 3512807 | W129: =R[-2]C+R[-1]C -> 541412 | X129: =R[-2]C+R[-1]C -> 2253940 | Y129: =R[-2]C+R[-1]C -> 628120 | Z129: =R[-2]C+R[-1]C -> 6936279 | AA129: =R[-2]C+R[-1]C -> 61135884
D130: Joindre un bulletin indiviuduel ID19 par salarié percevant plus de 80 000 FCFA par mois
C134: 1 Nationalité : Gabonais : 1 ; CEMAC : 2 ; Autres africains : 3 ; Non africains :4
C135: 2 Sexe : Masculin ; Feminin : 2
C136: 3 Situation familiale : Marié : 1 ; Célibataire : 2 ; Veuf : 3 ; Divorcé : 4
R138: N°Page
C140: Page N(dernière page)
C142: Feuillet n° | D142: N/N | L142: La présente déclaration est à déposer avant le 30 avril simultanément aux déclarations n° ID01 ou ID14
B144: E F F E C T I F S | C144: NIF | D144: Nom(s) et prénon(s) | E144: CODE | G144: AU 01/01/20… | L144: Période mois | P144: PRESENCE AU GABON | T144: Salaire brut de congés | U144: Total (1 à 5) | V144: IMPOTS RETENUS A LA SOURCE EN 20… | AA144: Indemnités non imposables
P145: Salaires brut de présence | Q145: AVANTAGES EN NATURE | S145: Indemnités imposables | V145: TCTS | W145: IRPP | X145: FNH | Y145: CFP | Z145: TOTAL (7+8+10)
E146: EMPLOI | F146: NIVEAU | G146: NATIONAL | H146: AGE | I146: SEXE | J146: SIT FAMI | K146: Nbre | L146: DEBUT | N146: FIN | Q146: Logt, Eau, Electricité | R146: Nourriture
K147: ENFANTS
G148: (1) | I148: (2) | J148: (3) | P148: (1) | Q148: (2) | R148: (3) | S148: (4) | T148: (5) | U148: (6) | V148: (7) | W148: (8) | X148: (9) | Y148: (10) | Z148: (11) | AA148: (12)
B149: 45 | C149: 0 | D149: 0 | E149: 0 | F149: 0 | G149: 0 | H149: 0 | I149: 0 | J149: 0 | K149: 0 | L149: 0 | M149: 0 | N149: 0 | O149: 0 | P149: 0 | Q149: 0 | R149: 0 | S149: 0 | T149: 0 | U149: 0 | V149: 0 | W149: 0 | X149: 0 | Y149: 0 | Z149: 0 | AA149: 0
B150: 46 | C150: 0 | D150: 0 | E150: 0 | F150: 0 | G150: 0 | H150: 0 | I150: 0 | J150: 0 | K150: 0 | L150: 0 | M150: 0 | N150: 0 | O150: 0 | P150: 0 | Q150: 0 | R150: 0 | S150: 0 | T150: 0 | U150: 0 | V150: 0 | W150: 0 | X150: 0 | Y150: 0 | Z150: 0 | AA150: 0
B151: 47 | C151: 0 | D151: 0 | E151: 0 | F151: 0 | G151: 0 | H151: 0 | I151: 0 | J151: 0 | K151: 0 | L151: 0 | M151: 0 | N151: 0 | O151: 0 | P151: 0 | Q151: 0 | R151: 0 | S151: 0 | T151: 0 | U151: 0 | V151: 0 | W151: 0 | X151: 0 | Y151: 0 | Z151: 0 | AA151: 0
B152: 48 | C152: 0 | D152: 0 | E152: 0 | F152: 0 | G152: 0 | H152: 0 | I152: 0 | J152: 0 | K152: 0 | L152: 0 | M152: 0 | N152: 0 | O152: 0 | P152: 0 | Q152: 0 | R152: 0 | S152: 0 | T152: 0 | U152: 0 | V152: 0 | W152: 0 | X152: 0 | Y152: 0 | Z152: 0 | AA152: 0
B153: 49 | C153: 0 | D153: 0 | E153: 0 | F153: 0 | G153: 0 | H153: 0 | I153: 0 | J153: 0 | K153: 0 | L153: 0 | M153: 0 | N153: 0 | O153: 0 | P153: 0 | Q153: 0 | R153: 0 | S153: 0 | T153: 0 | U153: 0 | V153: 0 | W153: 0 | X153: 0 | Y153: 0 | Z153: 0 | AA153: 0
B154: 50 | C154: 0 | D154: 0 | E154: 0 | F154: 0 | G154: 0 | H154: 0 | I154: 0 | J154: 0 | K154: 0 | L154: 0 | M154: 0 | N154: 0 | O154: 0 | P154: 0 | Q154: 0 | R154: 0 | S154: 0 | T154: 0 | U154: 0 | V154: 0 | W154: 0 | X154: 0 | Y154: 0 | Z154: 0 | AA154: 0
B155: 51 | C155: 0 | D155: 0 | E155: 0 | F155: 0 | G155: 0 | H155: 0 | I155: 0 | J155: 0 | K155: 0 | L155: 0 | M155: 0 | N155: 0 | O155: 0 | P155: 0 | Q155: 0 | R155: 0 | S155: 0 | T155: 0 | U155: 0 | V155: 0 | W155: 0 | X155: 0 | Y155: 0 | Z155: 0 | AA155: 0
B156: 52 | C156: 0 | D156: 0 | E156: 0 | F156: 0 | G156: 0 | H156: 0 | I156: 0 | J156: 0 | K156: 0 | L156: 0 | M156: 0 | N156: 0 | O156: 0 | P156: 0 | Q156: 0 | R156: 0 | S156: 0 | T156: 0 | U156: 0 | V156: 0 | W156: 0 | X156: 0 | Y156: 0 | Z156: 0 | AA156: 0
B157: 53 | C157: 0 | D157: 0 | E157: 0 | F157: 0 | G157: 0 | H157: 0 | I157: 0 | J157: 0 | K157: 0 | L157: 0 | M157: 0 | N157: 0 | O157: 0 | P157: 0 | Q157: 0 | R157: 0 | S157: 0 | T157: 0 | U157: 0 | V157: 0 | W157: 0 | X157: 0 | Y157: 0 | Z157: 0 | AA157: 0
B158: 54 | C158: 0 | D158: 0 | E158: 0 | F158: 0 | G158: 0 | H158: 0 | I158: 0 | J158: 0 | K158: 0 | L158: 0 | M158: 0 | N158: 0 | O158: 0 | P158: 0 | Q158: 0 | R158: 0 | S158: 0 | T158: 0 | U158: 0 | V158: 0 | W158: 0 | X158: 0 | Y158: 0 | Z158: 0 | AA158: 0
B159: 55 | C159: 0 | D159: 0 | E159: 0 | F159: 0 | G159: 0 | H159: 0 | I159: 0 | J159: 0 | K159: 0 | L159: 0 | M159: 0 | N159: 0 | O159: 0 | P159: 0 | Q159: 0 | R159: 0 | S159: 0 | T159: 0 | U159: 0 | V159: 0 | W159: 0 | X159: 0 | Y159: 0 | Z159: 0 | AA159: 0
B160: 56 | C160: 0 | D160: 0 | E160: 0 | F160: 0 | G160: 0 | H160: 0 | I160: 0 | J160: 0 | K160: 0 | L160: 0 | M160: 0 | N160: 0 | O160: 0 | P160: 0 | Q160: 0 | R160: 0 | S160: 0 | T160: 0 | U160: 0 | V160: 0 | W160: 0 | X160: 0 | Y160: 0 | Z160: 0 | AA160: 0
B161: 57 | C161: 0 | D161: 0 | E161: 0 | F161: 0 | G161: 0 | H161: 0 | I161: 0 | J161: 0 | K161: 0 | L161: 0 | M161: 0 | N161: 0 | O161: 0 | P161: 0 | Q161: 0 | R161: 0 | S161: 0 | T161: 0 | U161: 0 | V161: 0 | W161: 0 | X161: 0 | Y161: 0 | Z161: 0 | AA161: 0
D162: TOTAUX | P162: =SUM(R[-13]C:R[-1]C) -> 0 | Q162: =SUM(R[-13]C:R[-1]C) -> 0 | R162: =SUM(R[-13]C:R[-1]C) -> 0 | S162: =SUM(R[-13]C:R[-1]C) -> 0 | T162: =SUM(R[-13]C:R[-1]C) -> 0 | U162: =SUM(R[-13]C:R[-1]C) -> 0 | V162: =SUM(R[-13]C:R[-1]C) -> 0 | W162: =SUM(R[-13]C:R[-1]C) -> 0 | X162: =SUM(R[-13]C:R[-1]C) -> 0 | Y162: 0 | Z162: =SUM(R[-13]C:R[-1]C) -> 0 | AA162: =SUM(R[-13]C:R[-1]C) -> 0
D163: TOTAUX REPORTES DE LA FEUILLE PRECEDENTE | P163: =R[-34]C -> 74419335 | Q163: =R[-34]C -> 8309122 | R163: =R[-34]C -> 360000 | S163: =R[-34]C -> 6205912 | T163: =R[-34]C -> 900000 | U163: =R[-34]C -> 90194369 | V163: =R[-34]C -> 3512807 | W163: =R[-34]C -> 541412 | X163: =R[-34]C -> 2253940 | Y163: =R[-34]C -> 628120 | Z163: =R[-34]C -> 6936279 | AA163: =R[-34]C -> 61135884
D164: TOTAUX A REPORTER SUR LA FEUILLE SUIVANTE | P164: =R[-2]C+R[-1]C -> 74419335 | Q164: =R[-2]C+R[-1]C -> 8309122 | R164: =R[-2]C+R[-1]C -> 360000 | S164: =R[-2]C+R[-1]C -> 6205912 | T164: =R[-2]C+R[-1]C -> 900000 | U164: =R[-2]C+R[-1]C -> 90194369 | V164: =R[-2]C+R[-1]C -> 3512807 | W164: =R[-2]C+R[-1]C -> 541412 | X164: =R[-2]C+R[-1]C -> 2253940 | Y164: =R[-2]C+R[-1]C -> 628120 | Z164: =R[-2]C+R[-1]C -> 6936279 | AA164: =R[-2]C+R[-1]C -> 61135884
D165: Joindre un bulletin indiviuduel ID19 par salarié percevant plus de 80 000 FCFA par mois
C169: 1 Nationalité : Gabonais : 1 ; CEMAC : 2 ; Autres africains : 3 ; Non africains :4
C170: 2 Sexe : Masculin ; Feminin : 2
C171: 3 Situation familiale : Marié : 1 ; Célibataire : 2 ; Veuf : 3 ; Divorcé : 4
R180: N°Page